{
  "schema_version": "0.1.0",
  "run_id": "hcx_real_smoke_00000000000000000000000000000000",
  "created_at": "2026-09-02T00:00:00.000Z",
  "gate_status": "HCX_REAL_API_PROTOCOL_NOT_VERIFIED",
  "reason": "missing required configuration: HCX_API_KEY, HCX_ENDPOINT_URL, HCX_MODEL_ID; 0 real external calls made",
  "agent_quality_evaluated": false,
  "dev_tune_accessed": false,
  "dev_check_accessed": false,
  "holdout_accessed": false,
  "production_wiring_applied": false,
  "final_generation_model_selected": false
}
